Question,Similarity Score
"I have secured a placement in a school setting that is not a regional, remote or low socioeconomic school. If I am successful in my application will you help me change to a STARS-approved school setting?",0.15104055404663086
I am a Master of Teaching (Secondary) student applying for the STARS program. Does it matter the year level of placement or my Specialist Teaching Area?,0.14191029965877533
What if I have already organised my placement/s? Can I still participate in the program?,0.21801327168941498
How do I organise a placement in a STARS-approved school setting?,0.21585921943187714
What schools can I do my placement in as part of the STARS program?,0.318678617477417
How many practicums will I need to complete during the STARS program?,0.06502342224121094
How will the STARS program fit in with my current units of study?,0.11389750242233276
How many pre-service teachers can partake in the STARS program for 2022–2023 year?,0.15712250769138336
When does the STARS program commence?,0.09388728439807892
What if I want to continue studying after 1 December 2020?,0.19881688058376312
Can I enrol in a Professional Certificate?,0.16378512978553772
What is a Professional Certificate?,0.11905106902122498
What if I only want to complete two units?,-0.04950521141290665
Can I obtain help to defer payment?,-0.04229128360748291
How do I ensure I’m enrolled with a discounted fee?,0.07917355000972748
Why are these courses discounted?,0.2322859764099121
What is the entry criteria?,0.18906280398368835
What units will I study?,0.16113349795341492
Is the whole course discounted?,0.26897257566452026
Will you be offering courses as part of the government’s higher education relief package?,0.22067248821258545
Will I receive the same qualification as an on-campus student?,0.24718427658081055
Will I receive credit for my previous studies?,0.2203635275363922
Will I need to be screened to work with children?,-0.020292285829782486
Will I need to attend placements to complete the Diploma of Nursing?,0.33343398571014404
Will I have to sit exams in the Diploma of Nursing?,0.26077455282211304
Will I ever need to go to a campus?,0.32942086458206177
Will I be studying alone?,0.21999239921569824
Will I be charged interest on my HECS-HELP loan?,0.04467112943530083
Why is the Diploma of Nursing changing?,0.30216169357299805
Why is Swinburne Online a good study option during isolation?,0.1552141308784485
Who can I contact for support during my studies?,0.2644613981246948
Who can help me put together a study plan for my course?,0.17388980090618134
Who can help me if I am having technological difficulties?,-0.06163972616195679
Which units should I start with?,-0.03556258603930473
Which units can I take as electives?,0.11788158118724823
Where can I study online from?,0.31109219789505005
Where can I go for career advice?,0.10607695579528809
Where can I get important information about the VET Student Loan Program?,0.27047672867774963
Where can I get English language support?,0.11867502331733704
Where can I get assessment support?,0.14794039726257324
Where can I find out more about VET Student Loans?,0.2005733847618103
Where are Swinburne Online’s exam centres located?,0.36054208874702454
When will Swinburne Online be releasing the new Diploma of Nursing?,0.40535300970077515
When is the cut-off date for enrolment?,0.20611020922660828
What’s changing in the Diploma of Nursing?,0.3147605061531067
What sort of career prospects do I have with an online qualification?,0.08961323648691177
What resources are available to alumni once they have graduated?,0.2796364426612854
What level of English language proficiency do I need to study an undergraduate degree at Swinburne Online?,0.24042834341526031
What level of English language proficiency do I need to study a Masters at Swinburne Online?,0.2026999443769455
What kind of support do you offer to your online students?,0.09891800582408905
What is VET?,0.11513053625822067
What is Undergraduate Study?,0.3210316300392151
What is the Tableau Desktop Certified Specialist certification?,0.1232302337884903
What is the Student Amenities Help fee for and why do I have to pay it?,0.23349261283874512
What is the relationship between Swinburne University of Technology and Swinburne Online?,0.3355482816696167
What is the difference between a degree and a diploma?,0.18400974571704865
What is TAFE?,0.16511201858520508
What is Postgraduate Study?,0.26691728830337524
What is online education?,0.15381209552288055
What is Higher Education?,0.308759868144989
What is HECS-HELP?,0.07949385792016983
What is Distance Education?,0.260719358921051
What is an Honours Degree?,0.31758490204811096
What is an e-Learning Advisor and how can I contact them?,0.18231263756752014
What is a virtual classroom?,0.13308382034301758
What is an e-Learning Advisor and how can I contact them?,0.18231263756752014
What is a specialisation?,0.17870092391967773
What is a pre-requisite?,0.12400900572538376
What is a PhD?,0.32273203134536743
What is a Masters Degree?,0.27522629499435425
What is a major unit?,0.0779210776090622
What is a Graduate Diploma?,0.26262366771698
What is a Graduate Certificate?,0.25007402896881104
What is a Grade Point Average (GPA)?,0.21952109038829803
What is a good option for upskilling during this time?,-0.07352708280086517
What is a Double Degree?,0.22652047872543335
What is a Diploma?,0.23920461535453796
What is a Commonwealth Supported Place?,0.17520105838775635
What is a Certificate?,0.11172746866941452
What is a Bachelor Degree?,0.32032936811447144
What happens if I don’t pay my fees on time?,-0.005278562195599079
What devices will I need to complete my qualification?,-0.031027745455503464
"What are the main differences between online, on-campus and distance education?",0.19012905657291412
What are the entry requirements for the Diploma of Nursing?,0.31832176446914673
What are the entry requirements for TAFE Business courses?,0.26268109679222107
What are the benefits of acquiring a Tableau certification?,0.10649920254945755
What are placements?,0.19674545526504517
What are exemptions?,-0.020289696753025055
What are electives and why do I need to study them?,0.15169188380241394
What are core units?,-0.011632663197815418
Should I start studying now?,0.1497761756181717
Is there fee or financial assistance for Postgraduate Degrees?,0.31380969285964966
Is there fee or financial assistance for international students?,0.26156461238861084
Is there a graduation ceremony?,0.32166892290115356
Is now a good time to look at a career change?,0.0538671538233757
Is anyone eligible for a VSL?,0.06948085129261017
Is an online qualification a real qualification?,0.10133853554725647
"If I have just completed Year 12, can I apply to enrol in your March intake (Teaching Period 1)?",0.17758169770240784
If I have a VSL can I withdraw from my course?,0.13481676578521729
"I’m studying a TAFE Business course, will I have to sit exams?",0.13997924327850342
"I’m studying a degree, will I have to sit exams?",0.15377262234687805
"I’m interested in becoming a teacher. How will teaching placements work, given that your degrees are online?",0.1823771595954895
I'm not sure what to study. Who can help me?,0.15032844245433807
I'm not sure if I meet the entry requirements but I want to study. What should I do?,0.25356101989746094
"I currently work at an early childhood service, primary or secondary school, can I do my teaching placement at my workplace?",0.0768870934844017
How will a credit for previous studies appear on my transcript?,0.1794208437204361
How much will my course cost?,0.24853216111660004
How many units can I undertake per teaching period?,0.1287253350019455
How many placements do I have to do?,0.18194285035133362
How many hours of study per week are recommended per unit?,0.19781805574893951
How many alumni are there?,0.4366759657859802
How long will my application take to be assessed?,0.09162948280572891
How long will it take to earn my degree?,0.26874983310699463
How long has Swinburne been around for?,0.15976090729236603
How does your model of online study work for the Diploma of Nursing?,0.270277202129364
How does your model of online study work for TAFE?,0.18107381463050842
How does your model of online study work for higher education if there are no lectures?,0.20064055919647217
How does Swinburne University of Technology rate against other universities?,0.3837171196937561
How does online study work?,0.1495717316865921
How do I stay on track with my study?,0.11195874959230423
How do I repay my HELP loan?,0.09624768793582916
How do I apply to enrol in a degree or a diploma?,0.283200740814209
How do exams work?,0.09900643676519394
How do assessments work?,0.049892835319042206
How can I get in touch with other students?,0.27662086486816406
How are my placements arranged?,0.14640814065933228
Has Swinburne Online been affected by COVID-19?,0.04629749059677124
Does the Graduate Certification in Professional Data Analytics prepare me for the Tableau Desktop Certified Specialist certification exam?,0.11284176260232925
"Do you offer online support, or will I need to figure it all out myself?",-0.020375771448016167
Do you offer HECS-HELP and FEE-HELP?,0.08786703646183014
Do you have postgraduate programs?,0.3098302483558655
Do you have a head office somewhere if I want to meet someone face-to-face about my course?,0.35844624042510986
Do you accept international students?,0.23702184855937958
Do I need to purchase any learning materials for the Diploma of Nursing?,0.21763566136360168
Do I need to be logged on to study at specific times?,0.153333842754364
Do I need fancy software?,-0.026855602860450745
Do I have to purchase learning materials?,0.06924410909414291
Do I have to pay for my studies upfront?,0.21572646498680115
Can I study abroad?,0.24225667119026184
Can I study a mixture of on-campus and online units?,0.17880412936210632
Can I do my education placement outside of Australia?,0.3082244396209717
Can I cover the cost of my Introductory Skill Set Course using VET Student Loan?,0.1403191089630127
Are there dates I need to think about when applying for a VSL?,0.10011422634124756
Are the education degrees nationally recognised?,0.36643972992897034
Are the courses the same as the on-campus courses?,0.31480422616004944
Are Postgraduate students eligible for Commonwealth Supported Places (CSP)?,0.21403951942920685
Are placements available part time for education students?,0.25879353284835815
Are exams only held at the end of each teaching period?,0.17012642323970795
Am I eligible for a student concession card when studying online?,0.13372394442558289
Am I eligible for a Commonwealth Supported Place and a HELP loan?,0.1049460768699646
Am I able to study at Swinburne Online if I don't live in Victoria?,0.38733962178230286
>>>>>>> main
