Question,Similarity Score
What are the top 5 good customer service skills?,0.8582729697227478
How to demonstrate customer service skills?,0.826433002948761
How to describe customer service skills?,0.9275751113891602
What are customer service skills?,1.0
How can I transition out of a customer service job?,0.5154883861541748
What are transferable skills in customer service?,0.8754909038543701
What can you do after working in customer service?,0.6582930684089661
How do I pivot into business from customer service?,0.46162810921669006
What should I do after customer service?,0.5465366840362549
What is the career path for customer service agents?,0.6328150629997253
What is the most likely career for a customer support professional?,0.6101866960525513
What is the most common mistake when choosing a career?,0.2270348072052002
What to do if you are confused about your career?,0.1617284119129181
Why am I struggling to choose a career?,0.10948796570301056
Is it normal to not know what career you want?,0.06446736305952072
How to find your dream job?,0.18837639689445496
How do you figure out what you want to do as a career?,0.2274581640958786
What is the difference between a financial planner and a financial advisor?,0.2213520109653473
What qualifications do financial advisors need?,0.3374061584472656
How long does an MBA take in Australia?,0.11816220730543137
Who should do an MBA?,0.0777924582362175
Do you need a degree to do an MBA?,0.11177724599838257
Why study an MBA?,0.17857366800308228
What does an MBA teach?,0.2594970762729645
How long does it take to finish a part-time MBA?,0.06606902927160263
What is a weekend MBA?,0.19100695848464966
How long is a full-time MBA?,0.0798044428229332
How many hours a week is an MBA?,0.11480146646499634
Can you study an MBA part-time?,0.06975753605365753
Can you complete an MBA while working full time?,0.06655807793140411
Is it easy to get a scholarship for Masters in Australia?,0.00163193978369236
How do I get full funding for a Masters in Australia?,-0.05920310318470001
Do I have to pay for Masters in Australia?,-0.01591990515589714
How do I pay for postgraduate study in Australia?,0.031227990984916687
How many degrees can you put on HECS?,0.07582227140665054
Is Higher Education Loan Program (HELP) the same as HECS?,0.15427696704864502
Can you get a student loan for a masters in Australia?,0.04538602754473686
Is postgraduate study covered by HECS?,0.09910738468170166
How do you become a CEO of a company?,0.20854121446609497
How do you become a CEO in Australia?,0.21537189185619354
What skills do you need to become a CEO?,0.4647982120513916
What qualifications do most CEOs have?,0.3471728563308716
What qualifies you as a CEO?,0.26715558767318726
What is the best degree for a financial advisor?,0.1658850610256195
What is the job of a financial advisor?,0.3502812385559082
What are the duties of a financial advisor?,0.3701913356781006
What kind of person can be a financial advisor?,0.30303794145584106
Is it stressful to be a financial advisor?,0.17578095197677612
Is it hard being a financial advisor?,0.21573147177696228
How long does it take to make it as a financial advisor?,0.1558297574520111
How do I start being a financial advisor?,0.1823219507932663
What qualifications do I need to be a financial advisor in Australia?,0.2680312991142273
What is the main difference between a financial planner and a financial advisor in Australia?,0.23155783116817474
What is the main difference between a financial planner and a financial advisor?,0.2266148179769516
"Which is better, a financial planner or advisor?",0.15145355463027954
What are the three major skills needed to run a business?,0.6108652353286743
What should I study for small business?,0.2825762629508972
What degree is best for starting a business?,0.24614691734313965
What degree is best for starting a business?,0.24614691734313965
What is the most versatile business degree?,0.24055521190166473
Which business degree is best in Australia?,0.16671842336654663
What is the best type of business to major in?,0.1664227545261383
What are the four advantages of studying business environment?,0.3152572512626648
What are the benefits of doing business?,0.3851303458213806
How can studying business be beneficial for your future?,0.2125670611858368
Why study business courses in Australia?,0.3074479103088379
Do people with business degrees get jobs?,0.2946361303329468
What career outcomes can you get with a business degree?,0.28878873586654663
What job can you get with a business degree in Australia?,0.30106431245803833
What pays the most with a business degree?,0.18016913533210754
What will I learn in a business management degree?,0.30088818073272705
What is the definition of a business management degree?,0.2386540174484253
What are examples of business management?,0.33209505677223206
What is the meaning of business management?,0.3003210723400116
What are the main topics in business administration?,0.31765973567962646
What is the meaning of a degree in business administration?,0.2558739185333252
What is an example of business administration?,0.3217023015022278
What does a Business Administrator do?,0.41189152002334595
What is the difference between management and administration?,0.16623766720294952
What is the difference between business administration and business management?,0.18745528161525726
What support can I expect?,0.1919942945241928
Is an MBA too advanced for someone who has never studied?,0.0850922167301178
"As I am studying online, can I pursue full-time opportunities throughout my studies?",0.033218689262866974
Do these degrees provide any networking opportunities?,0.15457965433597565
How will Swinburne prepare me for future job opportunities?,0.2878204584121704
"With an MBA, does the institution matter?",0.04649120941758156
As a business leader/owner what value can an MBA add that I do not gain in my current vocation?,0.18908053636550903
What job opportunities require an MBA?,0.20728731155395508
What is the likelihood of employment with an MBA?,0.1395244002342224
Is there a pay increase between undergraduate and MBA students?,0.054114267230033875
Why should I choose Swinburne over different providers?,0.18493406474590302
What quantitative value can I hope for in taking on an MBA?,0.15373674035072327
Is STARS paid?,0.14047609269618988
Are STARS placements extra placements or part of my course?,0.1355961114168167
Can I complete my two STARS placements in the school that I am doing Permission To Teach (PTT) work? The school fits the low-socioeconomic criteria and have said they would be happy for me do my STARS placements there.,0.07668223232030869
"When Swinburne matches the student to the placement school, what is the criteria for travel expectations, will Swinburne match me to somewhere within a reasonable distance from my home or could it be anywhere in regional/rural Victoria?",0.10849019140005112
When do the STARS Canvas modules open? Would I be able to have access to them at the start of the teaching period as I'd like to work on the STARS module before placement?,0.07466711103916168
What will I receive at completion of this program?,0.1625407189130783
Will there be any financial support for travel or accommodation to undertake a placement in regional or remote Victoria?,0.16768869757652283
"I have secured a placement in a school setting that is not a regional, remote or low socioeconomic school. If I am successful in my application will you help me change to a STARS-approved school setting?",0.056298092007637024
I am a Master of Teaching (Secondary) student applying for the STARS program. Does it matter the year level of placement or my Specialist Teaching Area?,0.10661795735359192
What if I have already organised my placement/s? Can I still participate in the program?,0.06774090230464935
How do I organise a placement in a STARS-approved school setting?,0.04415962100028992
What schools can I do my placement in as part of the STARS program?,0.017089882865548134
How many practicums will I need to complete during the STARS program?,0.09974179416894913
How will the STARS program fit in with my current units of study?,0.10303518176078796
How many pre-service teachers can partake in the STARS program for 2022–2023 year?,0.15379615128040314
When does the STARS program commence?,0.03616241365671158
What if I want to continue studying after 1 December 2020?,-0.08058492839336395
Can I enrol in a Professional Certificate?,0.12348107248544693
What is a Professional Certificate?,0.26475635170936584
What if I only want to complete two units?,0.03781361132860184
Can I obtain help to defer payment?,0.12606334686279297
How do I ensure I’m enrolled with a discounted fee?,0.12995637953281403
Why are these courses discounted?,0.13472983241081238
What is the entry criteria?,0.17111390829086304
What units will I study?,0.11940975487232208
Is the whole course discounted?,0.08173768222332001
Will you be offering courses as part of the government’s higher education relief package?,0.09820328652858734
Will I receive the same qualification as an on-campus student?,0.090492382645607
Will I receive credit for my previous studies?,-0.013069665059447289
Will I need to be screened to work with children?,0.08095096051692963
Will I need to attend placements to complete the Diploma of Nursing?,0.09409470856189728
Will I have to sit exams in the Diploma of Nursing?,0.07269299030303955
Will I ever need to go to a campus?,-0.043319717049598694
Will I be studying alone?,-0.11894005537033081
Will I be charged interest on my HECS-HELP loan?,0.07384917885065079
Why is the Diploma of Nursing changing?,0.13886554539203644
Why is Swinburne Online a good study option during isolation?,0.09227501600980759
Who can I contact for support during my studies?,0.010626951232552528
Who can help me put together a study plan for my course?,0.050810471177101135
Who can help me if I am having technological difficulties?,0.15915103256702423
Which units should I start with?,0.14867223799228668
Which units can I take as electives?,0.14148113131523132
Where can I study online from?,-0.029312076047062874
Where can I go for career advice?,0.250270813703537
Where can I get important information about the VET Student Loan Program?,0.12574303150177002
Where can I get English language support?,0.11522330343723297
Where can I get assessment support?,0.18684864044189453
Where can I find out more about VET Student Loans?,0.1089734137058258
Where are Swinburne Online’s exam centres located?,0.19481317698955536
When will Swinburne Online be releasing the new Diploma of Nursing?,0.07344699651002884
When is the cut-off date for enrolment?,0.023234685882925987
What’s changing in the Diploma of Nursing?,0.1526610404253006
What sort of career prospects do I have with an online qualification?,0.2526918649673462
What resources are available to alumni once they have graduated?,0.12024536728858948
What level of English language proficiency do I need to study an undergraduate degree at Swinburne Online?,0.21261805295944214
What level of English language proficiency do I need to study a Masters at Swinburne Online?,0.2414710521697998
What kind of support do you offer to your online students?,0.31043294072151184
What is VET?,0.09476148337125778
What is Undergraduate Study?,0.07149822264909744
What is the Tableau Desktop Certified Specialist certification?,0.23042970895767212
What is the Student Amenities Help fee for and why do I have to pay it?,0.2093549370765686
What is the relationship between Swinburne University of Technology and Swinburne Online?,0.13204096257686615
What is the difference between a degree and a diploma?,0.12293919920921326
What is TAFE?,0.09260010719299316
What is Postgraduate Study?,0.13508200645446777
What is online education?,0.2400897592306137
What is Higher Education?,0.13881053030490875
What is HECS-HELP?,0.242806538939476
What is Distance Education?,0.21435976028442383
What is an Honours Degree?,0.09828481078147888
What is an e-Learning Advisor and how can I contact them?,0.14791344106197357
What is a virtual classroom?,0.1361018717288971
What is an e-Learning Advisor and how can I contact them?,0.14791344106197357
What is a specialisation?,0.258650541305542
What is a pre-requisite?,0.25440502166748047
What is a PhD?,0.11792804300785065
What is a Masters Degree?,0.06481241434812546
What is a major unit?,0.21829524636268616
What is a Graduate Diploma?,0.1205352246761322
What is a Graduate Certificate?,0.12423065304756165
What is a Grade Point Average (GPA)?,0.08435817062854767
What is a good option for upskilling during this time?,0.08947275578975677
What is a Double Degree?,0.04528162255883217
What is a Diploma?,0.19570042192935944
What is a Commonwealth Supported Place?,0.13029329478740692
What is a Certificate?,0.18918588757514954
What is a Bachelor Degree?,0.08901846408843994
What happens if I don’t pay my fees on time?,0.13133758306503296
What devices will I need to complete my qualification?,0.22307655215263367
"What are the main differences between online, on-campus and distance education?",0.15565302968025208
What are the entry requirements for the Diploma of Nursing?,0.1785525679588318
What are the entry requirements for TAFE Business courses?,0.32993900775909424
What are the benefits of acquiring a Tableau certification?,0.3042079210281372
What are placements?,0.3327847719192505
What are exemptions?,0.1193084567785263
What are electives and why do I need to study them?,0.19279614090919495
What are core units?,0.21338456869125366
Should I start studying now?,-0.07909780740737915
Is there fee or financial assistance for Postgraduate Degrees?,0.09426221251487732
Is there fee or financial assistance for international students?,0.0731625184416771
Is there a graduation ceremony?,-0.04372597485780716
Is now a good time to look at a career change?,0.0985606238245964
Is anyone eligible for a VSL?,0.14930565655231476
Is an online qualification a real qualification?,0.2538994550704956
"If I have just completed Year 12, can I apply to enrol in your March intake (Teaching Period 1)?",-0.006345628760755062
If I have a VSL can I withdraw from my course?,0.0117505993694067
"I’m studying a TAFE Business course, will I have to sit exams?",0.20525069534778595
"I’m studying a degree, will I have to sit exams?",0.03040900267660618
"I’m interested in becoming a teacher. How will teaching placements work, given that your degrees are online?",0.20511199533939362
I'm not sure what to study. Who can help me?,0.032420508563518524
I'm not sure if I meet the entry requirements but I want to study. What should I do?,0.004266479052603245
"I currently work at an early childhood service, primary or secondary school, can I do my teaching placement at my workplace?",0.1724119633436203
How will a credit for previous studies appear on my transcript?,-0.020794175565242767
How much will my course cost?,0.050554219633340836
How many units can I undertake per teaching period?,0.18042299151420593
How many placements do I have to do?,0.20146915316581726
How many hours of study per week are recommended per unit?,0.1098199412226677
How many alumni are there?,0.02365037240087986
How long will my application take to be assessed?,0.09056319296360016
How long will it take to earn my degree?,-0.028892751783132553
How long has Swinburne been around for?,0.0569317489862442
How does your model of online study work for the Diploma of Nursing?,0.2674868106842041
How does your model of online study work for TAFE?,0.2702322006225586
How does your model of online study work for higher education if there are no lectures?,0.1778193712234497
How does Swinburne University of Technology rate against other universities?,0.11268571764230728
How does online study work?,0.1932964026927948
How do I stay on track with my study?,-0.009630760177969933
How do I repay my HELP loan?,0.1592014729976654
How do I apply to enrol in a degree or a diploma?,0.06630786508321762
How do exams work?,0.17269381880760193
How do assessments work?,0.26225584745407104
How can I get in touch with other students?,0.11999207735061646
How are my placements arranged?,0.15495944023132324
Has Swinburne Online been affected by COVID-19?,0.02783992886543274
Does the Graduate Certification in Professional Data Analytics prepare me for the Tableau Desktop Certified Specialist certification exam?,0.13749629259109497
"Do you offer online support, or will I need to figure it all out myself?",0.15833278000354767
Do you offer HECS-HELP and FEE-HELP?,0.2549922466278076
Do you have postgraduate programs?,0.14592304825782776
Do you have a head office somewhere if I want to meet someone face-to-face about my course?,0.09843809902667999
Do you accept international students?,0.10521680861711502
Do I need to purchase any learning materials for the Diploma of Nursing?,0.15918046236038208
Do I need to be logged on to study at specific times?,-0.018530935049057007
Do I need fancy software?,0.10625332593917847
Do I have to purchase learning materials?,0.16963867843151093
Do I have to pay for my studies upfront?,-0.01748953014612198
Can I study abroad?,-0.0782569944858551
Can I study a mixture of on-campus and online units?,0.045614611357450485
Can I do my education placement outside of Australia?,0.007914001122117043
Can I cover the cost of my Introductory Skill Set Course using VET Student Loan?,0.11862768232822418
Are there dates I need to think about when applying for a VSL?,0.10883212089538574
Are the education degrees nationally recognised?,0.020807484164834023
Are the courses the same as the on-campus courses?,0.06393256783485413
Are Postgraduate students eligible for Commonwealth Supported Places (CSP)?,0.1221511960029602
Are placements available part time for education students?,0.17183850705623627
Are exams only held at the end of each teaching period?,0.058953844010829926
Am I eligible for a student concession card when studying online?,0.12388557195663452
Am I eligible for a Commonwealth Supported Place and a HELP loan?,0.14496982097625732
Am I able to study at Swinburne Online if I don't live in Victoria?,0.030731385573744774
