Question,Similarity Score
<<<<<<< HEAD
What are the top 5 good customer service skills?,0.14393725991249084
How to demonstrate customer service skills?,0.10972373187541962
How to describe customer service skills?,0.13808971643447876
What are customer service skills?,0.12023139744997025
How can I transition out of a customer service job?,0.11950408667325974
What are transferable skills in customer service?,0.15966084599494934
What can you do after working in customer service?,0.18390969932079315
How do I pivot into business from customer service?,0.15166614949703217
What should I do after customer service?,0.07638423144817352
What is the career path for customer service agents?,0.22226938605308533
What is the most likely career for a customer support professional?,0.2290067970752716
What is the most common mistake when choosing a career?,0.24164840579032898
What to do if you are confused about your career?,0.22803077101707458
Why am I struggling to choose a career?,0.15403500199317932
Is it normal to not know what career you want?,0.18422715365886688
How to find your dream job?,0.20838171243667603
How do you figure out what you want to do as a career?,0.26936715841293335
What is the difference between a financial planner and a financial advisor?,0.24060888588428497
What qualifications do financial advisors need?,0.28432321548461914
How long does an MBA take in Australia?,0.6229521632194519
Who should do an MBA?,0.7466137409210205
Do you need a degree to do an MBA?,0.6560457944869995
Why study an MBA?,0.7358639240264893
What does an MBA teach?,0.7646154165267944
How long does it take to finish a part-time MBA?,0.49694836139678955
What is a weekend MBA?,0.6759129762649536
How long is a full-time MBA?,0.6154288053512573
How many hours a week is an MBA?,0.6238439083099365
Can you study an MBA part-time?,0.5984883904457092
Can you complete an MBA while working full time?,0.5803941488265991
Is it easy to get a scholarship for Masters in Australia?,0.32854151725769043
How do I get full funding for a Masters in Australia?,0.3078615665435791
Do I have to pay for Masters in Australia?,0.33025550842285156
How do I pay for postgraduate study in Australia?,0.29213380813598633
How many degrees can you put on HECS?,0.13337481021881104
Is Higher Education Loan Program (HELP) the same as HECS?,0.26867151260375977
Can you get a student loan for a masters in Australia?,0.38087713718414307
Is postgraduate study covered by HECS?,0.3902384638786316
How do you become a CEO of a company?,0.3066883385181427
How do you become a CEO in Australia?,0.34234893321990967
What skills do you need to become a CEO?,0.2693699598312378
What qualifications do most CEOs have?,0.31702667474746704
What qualifies you as a CEO?,0.3217598795890808
What is the best degree for a financial advisor?,0.40611588954925537
What is the job of a financial advisor?,0.3361080288887024
What are the duties of a financial advisor?,0.2733490467071533
What kind of person can be a financial advisor?,0.2917518615722656
Is it stressful to be a financial advisor?,0.20969811081886292
Is it hard being a financial advisor?,0.22071893513202667
How long does it take to make it as a financial advisor?,0.23833179473876953
How do I start being a financial advisor?,0.24185490608215332
What qualifications do I need to be a financial advisor in Australia?,0.2740491032600403
What is the main difference between a financial planner and a financial advisor in Australia?,0.26279380917549133
What is the main difference between a financial planner and a financial advisor?,0.24542899429798126
"Which is better, a financial planner or advisor?",0.307569295167923
What are the three major skills needed to run a business?,0.23177427053451538
What should I study for small business?,0.3933209776878357
What degree is best for starting a business?,0.3830310106277466
What degree is best for starting a business?,0.3830310106277466
What is the most versatile business degree?,0.4837315082550049
Which business degree is best in Australia?,0.48114827275276184
What is the best type of business to major in?,0.4487977623939514
What are the four advantages of studying business environment?,0.390001118183136
What are the benefits of doing business?,0.26312723755836487
How can studying business be beneficial for your future?,0.4213447868824005
Why study business courses in Australia?,0.45692312717437744
Do people with business degrees get jobs?,0.35468190908432007
What career outcomes can you get with a business degree?,0.41590002179145813
What job can you get with a business degree in Australia?,0.4332070052623749
What pays the most with a business degree?,0.40985044836997986
What will I learn in a business management degree?,0.4976111054420471
What is the definition of a business management degree?,0.5210655927658081
What are examples of business management?,0.466148316860199
What is the meaning of business management?,0.497946560382843
What are the main topics in business administration?,0.4224732220172882
What is the meaning of a degree in business administration?,0.477443128824234
What is an example of business administration?,0.44776028394699097
What does a Business Administrator do?,0.37456822395324707
What is the difference between management and administration?,0.34407463669776917
What is the difference between business administration and business management?,0.40300649404525757
What support can I expect?,0.06378480792045593
Is an MBA too advanced for someone who has never studied?,0.5606565475463867
"As I am studying online, can I pursue full-time opportunities throughout my studies?",0.2731461524963379
Do these degrees provide any networking opportunities?,0.3164982795715332
How will Swinburne prepare me for future job opportunities?,0.26511022448539734
"With an MBA, does the institution matter?",0.662254810333252
As a business leader/owner what value can an MBA add that I do not gain in my current vocation?,0.5423847436904907
What job opportunities require an MBA?,0.6958307027816772
What is the likelihood of employment with an MBA?,0.6607124209403992
Is there a pay increase between undergraduate and MBA students?,0.5409790277481079
Why should I choose Swinburne over different providers?,0.03460227698087692
What quantitative value can I hope for in taking on an MBA?,0.581881582736969
Is STARS paid?,0.09688973426818848
Are STARS placements extra placements or part of my course?,0.22928354144096375
Can I complete my two STARS placements in the school that I am doing Permission To Teach (PTT) work? The school fits the low-socioeconomic criteria and have said they would be happy for me do my STARS placements there.,0.16557684540748596
"When Swinburne matches the student to the placement school, what is the criteria for travel expectations, will Swinburne match me to somewhere within a reasonable distance from my home or could it be anywhere in regional/rural Victoria?",0.18537357449531555
When do the STARS Canvas modules open? Would I be able to have access to them at the start of the teaching period as I'd like to work on the STARS module before placement?,0.14859172701835632
What will I receive at completion of this program?,0.25637853145599365
Will there be any financial support for travel or accommodation to undertake a placement in regional or remote Victoria?,0.14438728988170624
"I have secured a placement in a school setting that is not a regional, remote or low socioeconomic school. If I am successful in my application will you help me change to a STARS-approved school setting?",0.17079147696495056
I am a Master of Teaching (Secondary) student applying for the STARS program. Does it matter the year level of placement or my Specialist Teaching Area?,0.27438032627105713
What if I have already organised my placement/s? Can I still participate in the program?,0.23389650881290436
How do I organise a placement in a STARS-approved school setting?,0.23463532328605652
What schools can I do my placement in as part of the STARS program?,0.30282604694366455
How many practicums will I need to complete during the STARS program?,0.22419825196266174
How will the STARS program fit in with my current units of study?,0.2822791635990143
How many pre-service teachers can partake in the STARS program for 2022–2023 year?,0.21601086854934692
When does the STARS program commence?,0.1786174476146698
What if I want to continue studying after 1 December 2020?,0.300112783908844
Can I enrol in a Professional Certificate?,0.25438863039016724
What is a Professional Certificate?,0.23043878376483917
What if I only want to complete two units?,0.09183425456285477
Can I obtain help to defer payment?,-0.03402796387672424
How do I ensure I’m enrolled with a discounted fee?,0.11889104545116425
Why are these courses discounted?,0.31413060426712036
What is the entry criteria?,0.3273952007293701
What units will I study?,0.3228495717048645
Is the whole course discounted?,0.29701900482177734
Will you be offering courses as part of the government’s higher education relief package?,0.3300841450691223
Will I receive the same qualification as an on-campus student?,0.3001088798046112
Will I receive credit for my previous studies?,0.25797605514526367
Will I need to be screened to work with children?,0.0475335419178009
Will I need to attend placements to complete the Diploma of Nursing?,0.19077655673027039
Will I have to sit exams in the Diploma of Nursing?,0.21830567717552185
Will I ever need to go to a campus?,0.1946718990802765
Will I be studying alone?,0.19933584332466125
Will I be charged interest on my HECS-HELP loan?,0.05283355712890625
Why is the Diploma of Nursing changing?,0.2566220760345459
Why is Swinburne Online a good study option during isolation?,0.14973130822181702
Who can I contact for support during my studies?,0.3089320957660675
Who can help me put together a study plan for my course?,0.2900643050670624
Who can help me if I am having technological difficulties?,0.03007727488875389
Which units should I start with?,0.12614819407463074
Which units can I take as electives?,0.2693766951560974
Where can I study online from?,0.2983326017856598
Where can I go for career advice?,0.2590324878692627
Where can I get important information about the VET Student Loan Program?,0.21342389285564423
Where can I get English language support?,0.13106903433799744
Where can I get assessment support?,0.21795779466629028
Where can I find out more about VET Student Loans?,0.16979561746120453
Where are Swinburne Online’s exam centres located?,0.24257594347000122
When will Swinburne Online be releasing the new Diploma of Nursing?,0.28497689962387085
When is the cut-off date for enrolment?,0.26875489950180054
What’s changing in the Diploma of Nursing?,0.2600264549255371
What sort of career prospects do I have with an online qualification?,0.2721967399120331
What resources are available to alumni once they have graduated?,0.26471590995788574
What level of English language proficiency do I need to study an undergraduate degree at Swinburne Online?,0.21012671291828156
What level of English language proficiency do I need to study a Masters at Swinburne Online?,0.2589302957057953
What kind of support do you offer to your online students?,0.17578229308128357
What is VET?,0.06950461864471436
What is Undergraduate Study?,0.4272270202636719
What is the Tableau Desktop Certified Specialist certification?,0.21498426795005798
What is the Student Amenities Help fee for and why do I have to pay it?,0.22675059735774994
What is the relationship between Swinburne University of Technology and Swinburne Online?,0.23310035467147827
What is the difference between a degree and a diploma?,0.23763534426689148
What is TAFE?,0.11007609218358994
What is Postgraduate Study?,0.4534981846809387
What is online education?,0.24407140910625458
What is Higher Education?,0.4296410083770752
What is HECS-HELP?,0.14545762538909912
What is Distance Education?,0.32779932022094727
What is an Honours Degree?,0.34819328784942627
What is an e-Learning Advisor and how can I contact them?,0.25942254066467285
What is a virtual classroom?,0.1777936816215515
What is an e-Learning Advisor and how can I contact them?,0.25942254066467285
What is a specialisation?,0.20538707077503204
What is a pre-requisite?,0.21248723566532135
What is a PhD?,0.25805744528770447
What is a Masters Degree?,0.4484747648239136
What is a major unit?,0.211415097117424
What is a Graduate Diploma?,0.34805405139923096
What is a Graduate Certificate?,0.39170560240745544
What is a Grade Point Average (GPA)?,0.17802366614341736
What is a good option for upskilling during this time?,0.09595122933387756
What is a Double Degree?,0.2011423259973526
What is a Diploma?,0.3086143732070923
What is a Commonwealth Supported Place?,0.14980846643447876
What is a Certificate?,0.19342441856861115
What is a Bachelor Degree?,0.37497788667678833
What happens if I don’t pay my fees on time?,0.006861411966383457
What devices will I need to complete my qualification?,0.24046817421913147
"What are the main differences between online, on-campus and distance education?",0.19386519491672516
What are the entry requirements for the Diploma of Nursing?,0.27939707040786743
What are the entry requirements for TAFE Business courses?,0.43757620453834534
What are the benefits of acquiring a Tableau certification?,0.16316960752010345
What are placements?,0.2130069136619568
What are exemptions?,0.09970813244581223
What are electives and why do I need to study them?,0.19873003661632538
What are core units?,0.19374364614486694
Should I start studying now?,0.237573504447937
Is there fee or financial assistance for Postgraduate Degrees?,0.33875972032546997
Is there fee or financial assistance for international students?,0.26337218284606934
Is there a graduation ceremony?,0.23554684221744537
Is now a good time to look at a career change?,0.20093315839767456
Is anyone eligible for a VSL?,0.142423614859581
Is an online qualification a real qualification?,0.23059462010860443
"If I have just completed Year 12, can I apply to enrol in your March intake (Teaching Period 1)?",0.2872936725616455
If I have a VSL can I withdraw from my course?,0.22882413864135742
"I’m studying a TAFE Business course, will I have to sit exams?",0.2894630432128906
"I’m studying a degree, will I have to sit exams?",0.20158016681671143
"I’m interested in becoming a teacher. How will teaching placements work, given that your degrees are online?",0.14002376794815063
I'm not sure what to study. Who can help me?,0.2441430687904358
I'm not sure if I meet the entry requirements but I want to study. What should I do?,0.3163726031780243
"I currently work at an early childhood service, primary or secondary school, can I do my teaching placement at my workplace?",0.15240126848220825
How will a credit for previous studies appear on my transcript?,0.1900440752506256
How much will my course cost?,0.329213947057724
How many units can I undertake per teaching period?,0.2886408269405365
How many placements do I have to do?,0.20494163036346436
How many hours of study per week are recommended per unit?,0.30295711755752563
How many alumni are there?,0.35174113512039185
How long will my application take to be assessed?,0.16678525507450104
How long will it take to earn my degree?,0.31162238121032715
How long has Swinburne been around for?,0.07604825496673584
How does your model of online study work for the Diploma of Nursing?,0.2587485909461975
How does your model of online study work for TAFE?,0.2318158894777298
How does your model of online study work for higher education if there are no lectures?,0.26000168919563293
How does Swinburne University of Technology rate against other universities?,0.3110429048538208
How does online study work?,0.22207041084766388
How do I stay on track with my study?,0.1437893509864807
How do I repay my HELP loan?,0.06920874118804932
How do I apply to enrol in a degree or a diploma?,0.3035704791545868
How do exams work?,0.2557809054851532
How do assessments work?,0.1826876699924469
How can I get in touch with other students?,0.2648283839225769
How are my placements arranged?,0.1704193651676178
Has Swinburne Online been affected by COVID-19?,-0.040775127708911896
Does the Graduate Certification in Professional Data Analytics prepare me for the Tableau Desktop Certified Specialist certification exam?,0.20233315229415894
"Do you offer online support, or will I need to figure it all out myself?",-0.025466710329055786
Do you offer HECS-HELP and FEE-HELP?,0.149536594748497
Do you have postgraduate programs?,0.41675564646720886
Do you have a head office somewhere if I want to meet someone face-to-face about my course?,0.28029268980026245
Do you accept international students?,0.2359059751033783
Do I need to purchase any learning materials for the Diploma of Nursing?,0.16760554909706116
Do I need to be logged on to study at specific times?,0.19176267087459564
Do I need fancy software?,0.0817713588476181
Do I have to purchase learning materials?,0.1622542440891266
Do I have to pay for my studies upfront?,0.2530484199523926
Can I study abroad?,0.2793582081794739
Can I study a mixture of on-campus and online units?,0.2762371897697449
Can I do my education placement outside of Australia?,0.2737851142883301
Can I cover the cost of my Introductory Skill Set Course using VET Student Loan?,0.1707686483860016
Are there dates I need to think about when applying for a VSL?,0.16592997312545776
Are the education degrees nationally recognised?,0.3065202236175537
Are the courses the same as the on-campus courses?,0.30439049005508423
Are Postgraduate students eligible for Commonwealth Supported Places (CSP)?,0.25111711025238037
Are placements available part time for education students?,0.29143229126930237
Are exams only held at the end of each teaching period?,0.22467057406902313
Am I eligible for a student concession card when studying online?,0.2412836253643036
Am I eligible for a Commonwealth Supported Place and a HELP loan?,0.12021627277135849
Am I able to study at Swinburne Online if I don't live in Victoria?,0.261529803276062
=======
What are the top 5 good customer service skills?,-0.05255304276943207
How to demonstrate customer service skills?,-0.07110472023487091
How to describe customer service skills?,-0.07335220277309418
What are customer service skills?,-0.06935387849807739
How can I transition out of a customer service job?,-0.03164184093475342
What are transferable skills in customer service?,-0.04265861585736275
What can you do after working in customer service?,-0.027918731793761253
How do I pivot into business from customer service?,-0.052500322461128235
What should I do after customer service?,-0.05627128481864929
What is the career path for customer service agents?,0.09159837663173676
What is the most likely career for a customer support professional?,0.03623441606760025
What is the most common mistake when choosing a career?,0.029760554432868958
What to do if you are confused about your career?,0.010280042886734009
Why am I struggling to choose a career?,0.02530297078192234
Is it normal to not know what career you want?,0.0784931480884552
How to find your dream job?,0.1956748366355896
How do you figure out what you want to do as a career?,0.09232845902442932
What is the difference between a financial planner and a financial advisor?,0.06822856515645981
What qualifications do financial advisors need?,0.14033830165863037
How long does an MBA take in Australia?,0.2935534119606018
Who should do an MBA?,0.18189120292663574
Do you need a degree to do an MBA?,0.25411829352378845
Why study an MBA?,0.20658572018146515
What does an MBA teach?,0.22754120826721191
How long does it take to finish a part-time MBA?,0.19272318482398987
What is a weekend MBA?,0.2091677486896515
How long is a full-time MBA?,0.21658393740653992
How many hours a week is an MBA?,0.223212331533432
Can you study an MBA part-time?,0.1969611644744873
Can you complete an MBA while working full time?,0.15407481789588928
Is it easy to get a scholarship for Masters in Australia?,0.3349947929382324
How do I get full funding for a Masters in Australia?,0.24021440744400024
Do I have to pay for Masters in Australia?,0.23752503097057343
How do I pay for postgraduate study in Australia?,0.2634347379207611
How many degrees can you put on HECS?,0.1515081822872162
Is Higher Education Loan Program (HELP) the same as HECS?,0.21593746542930603
Can you get a student loan for a masters in Australia?,0.30545857548713684
Is postgraduate study covered by HECS?,0.23165370523929596
How do you become a CEO of a company?,0.12052416801452637
How do you become a CEO in Australia?,0.1999688744544983
What skills do you need to become a CEO?,0.029901793226599693
What qualifications do most CEOs have?,0.09301447868347168
What qualifies you as a CEO?,0.0614444725215435
What is the best degree for a financial advisor?,0.2433614283800125
What is the job of a financial advisor?,0.17187082767486572
What are the duties of a financial advisor?,0.12053608894348145
What kind of person can be a financial advisor?,0.10635512322187424
Is it stressful to be a financial advisor?,0.07912394404411316
Is it hard being a financial advisor?,0.11591652035713196
How long does it take to make it as a financial advisor?,0.1603601574897766
How do I start being a financial advisor?,0.11483342945575714
What qualifications do I need to be a financial advisor in Australia?,0.15990370512008667
What is the main difference between a financial planner and a financial advisor in Australia?,0.1370438039302826
What is the main difference between a financial planner and a financial advisor?,0.07789722084999084
"Which is better, a financial planner or advisor?",0.07480242848396301
What are the three major skills needed to run a business?,-0.009502025321125984
What should I study for small business?,0.06322349607944489
What degree is best for starting a business?,0.19107221066951752
What degree is best for starting a business?,0.19107221066951752
What is the most versatile business degree?,0.2503960132598877
Which business degree is best in Australia?,0.3343200087547302
What is the best type of business to major in?,0.14399774372577667
What are the four advantages of studying business environment?,0.14523962140083313
What are the benefits of doing business?,0.04604337736964226
How can studying business be beneficial for your future?,0.15762418508529663
Why study business courses in Australia?,0.2819134294986725
Do people with business degrees get jobs?,0.19700729846954346
What career outcomes can you get with a business degree?,0.18148887157440186
What job can you get with a business degree in Australia?,0.24311566352844238
What pays the most with a business degree?,0.22873559594154358
What will I learn in a business management degree?,0.1689433604478836
What is the definition of a business management degree?,0.2152092158794403
What are examples of business management?,0.09426389634609222
What is the meaning of business management?,0.1284877359867096
What are the main topics in business administration?,0.05264122039079666
What is the meaning of a degree in business administration?,0.2122647762298584
What is an example of business administration?,0.07660884410142899
What does a Business Administrator do?,0.048276402056217194
What is the difference between management and administration?,0.03276517242193222
What is the difference between business administration and business management?,0.04438753426074982
What support can I expect?,-0.031489837914705276
Is an MBA too advanced for someone who has never studied?,0.19697152078151703
"As I am studying online, can I pursue full-time opportunities throughout my studies?",0.14221607148647308
Do these degrees provide any networking opportunities?,0.3128178119659424
How will Swinburne prepare me for future job opportunities?,0.12338712066411972
"With an MBA, does the institution matter?",0.27388685941696167
As a business leader/owner what value can an MBA add that I do not gain in my current vocation?,0.05770105868577957
What job opportunities require an MBA?,0.2200661301612854
What is the likelihood of employment with an MBA?,0.19801969826221466
Is there a pay increase between undergraduate and MBA students?,0.18355634808540344
Why should I choose Swinburne over different providers?,0.020632779225707054
What quantitative value can I hope for in taking on an MBA?,0.14286649227142334
Is STARS paid?,-0.0440337136387825
Are STARS placements extra placements or part of my course?,0.15374450385570526
Can I complete my two STARS placements in the school that I am doing Permission To Teach (PTT) work? The school fits the low-socioeconomic criteria and have said they would be happy for me do my STARS placements there.,0.18662868440151215
"When Swinburne matches the student to the placement school, what is the criteria for travel expectations, will Swinburne match me to somewhere within a reasonable distance from my home or could it be anywhere in regional/rural Victoria?",0.314596563577652
When do the STARS Canvas modules open? Would I be able to have access to them at the start of the teaching period as I'd like to work on the STARS module before placement?,0.02956700138747692
What will I receive at completion of this program?,0.14397065341472626
Will there be any financial support for travel or accommodation to undertake a placement in regional or remote Victoria?,0.21987119317054749
